ID;Descrição;Preço em R$
307;Placa-Mãe Brazil PC, Intel H55 LGA 1156, DDR3 - BPC-H55-V1.51;R$ 566,99
308;Placa Mae Esonic H110 Intel, LGA1151;R$ 479,00
309;Placa Mãe Keepdata H55-kdg Socket, LGA 1156, VGA, DDR3;R$ 289,80
310;Placa Mãe Keepdata B75-kdgnv Socket, LGA 1155, VGA, DDR3;R$ 423,75
311;USADO - Placa Mae H510m-k M.2, V20, Intel 1200  - Excelente;R$ 421,86
312;Placa Mãe Duex Dx-b760zg, Intel 13ª, 12ª Geração, DDR5, LGA1700, Micro ATX;R$ 785,26
313;Placa Mãe Ght, H81, LGA 1150, DDR3, VGA, HDMI;R$ 264,90
314;Placa Mae Asrock H510m-hdv m.2 Se, DDR4;R$ 480,00
315;Placa Mãe Keepdata H81-kdgnv, LGA 1150, Giga/nvme/hdmi.;R$ 360,75
316;Placa Mãe Msi Pro Z690-p, ATX, LGA 1700, DDR4, HDMI, Displayport, M.2, USB 3.2;R$ 1.594,90
317;Placa Mãe Msi B760 Gaming Plus, Intel, Lga 1700, DDR5, Wifi  - 911-7d98-007;R$ 1.727,90
318;Placa Mãe B75 1155 Brx, C/ Caixa Box Lan, 10, 100, 1000;R$ 339,92
319;Placa Mãe Gigabyte B650e Aorus Master, WIFI, Am5, ATX, DDR5, HDMI, USB 3.2, M.2;R$ 4.518,90
320;Placa Mãe Gigabyte B760i Aorus Pro, Intel Lga1700, Chipset B760, Mitx, Ddr5 - B760i Aorus Pro;R$ 2.524,90
321;Placa Mãe Gigabyte, B450m K, AMD, Am4, MATX, DDR4;R$ 540,00
322;Placa Mãe Msi B650, Gaming Plus Wi-fi, Atx Am5 Ddr5 HDMI, Displayport M.2 Usb 3.2;R$ 2.019,90
323;Placa Mãe Gigabyte Z790 Aorus Elite X, WIFI 7, ATX, LGA 1700, DDR5, HDMI. Dp M.2, USB 3.2;R$ 3.588,90
324;Kit Placa Mãe Oem H61 1155 Processador Core I5 2400 4GB RAM;R$ 680,00
325;Placa Mãe Gigabyte B760m Aorus Elite X Ax, MATX, WIFI, LGA 1700, DDR5, HDMI, Dp, M.2 UDB 3.2;R$ 2.325,90
326;Placa Mãe Gigabyte Z790 Aorus Elite X Ax, ATX, WIFI, LGA 1700, DDR5, HDMI Dp M.2, USB 3.2;R$ 3.441,90
327;Placa Mãe Keepdata H61-kdgnv, LGA 1155, Giga/nvme/hdmi;R$ 218,40
328;Placa-Mãe Msi Mag Z790 Tomahawk Wi-Fi, Intel LGA 1700, DDR4 - 911-7d91-006;R$ 3.474,77
329;Placa Mãe Gigabyte B760m Ds3h, Intel LGA1700, Microatx, DDR4;R$ 1.262,90
330;Placa Mãe Gigabyte Z790i Aorus Ultra, Wi-fi, Ddr5, Itx, Lga1700;R$ 5.709,90
331;Placa Mãe I3/i5/i7 Pcware Ipmh610g;R$ 493,41
332;Placa Mae Duex Intel Socket 1150, DDR3;R$ 456,00
333;Placa Mãe Goldentec, AMD, A320 DDR4 | Gt;R$ 440,32
334;Placa-Mãe Lga Am4 Dx-a320 - Duex;R$ 450,47
335;Placa Mãe Asus I3/i5/i7, Prime Mini Itx H510t2/csm 10/11 Geração;R$ 1.064,70
336;Placa Mãe Gigabyte B760m, Aorus Elite (rev. 1.0), LGA 1700, DDR5;R$ 2.190,00
337;Placa Mãe Asus Prime H310m-e R2.0/br,1151,DDR4,HDMId-sub,USB, 3.1/m.2;R$ 895,90
338;Placa Mae Intel 775, ATX 975X - BOXD975XBXLKR;R$ 299,00
339;Placa Mãe Keepdata H61-kdgnv Socket, LGA 1155, VGA, DDR3;R$ 362,86
340;Placa Mãe Afox H510d4ma6v2 LGA1200, DDR4,HDMI;R$ 440,65
341;Placa Mãe Duex Dx H61zg, DDR3, Socket 1155, M-ATX, Chipset Intel H61;R$ 295,99
342;Placa Mãe Msi B760 Gaming Plus, Wi-fi, DDR5, ATX, LGA1700;R$ 3.189,90
343;Placa-Mãe Msi Mag Z790 Tomahawk Wi-Fi, Intel LGA 1700, DDR5 - 911-7d91-019;R$ 3.322,90
344;Placa Mãe Para Servidor Intel Xeon Asrock E3c252d4u - (lga 1200 - Ddr4 Ecc), Chipset C252, Dual Lan;R$ 4.625,99
345;Placa Mãe Keepdata H61-kdgnv Socket, LGA 1155, VGA, DDR3;R$ 362,86
346;Placa Mãe Knup A520, AMD Ryzen AM4, HDMI, DDR4, 16GB,  6 GB/s USB 3.0;R$ 560,01
347;Placa Mãe Msi Mag B760 Tomahawk, Intel, Lga 1700, DDR4, Wifi - 911-7d96-003;R$ 2.383,66
348;Placa-Mãe BRX H510, Intel, 1200, Micro ATX, VGA, HDMI, DDR4;R$ 390,92
349;Placa Mãe Gigabyte B650 Aorus Pro Ax, WIFI, Am5, ATX, DDR5, HDMI, USB 3.2, M.2;R$ 3.588,90
350;Placa Mae Revenger G-h61/k, DDR3, Socket 1155;R$ 330,90
351;Processador Intel Core I5 13400f, 2.50ghz, 10-core, LGA1700;R$ 2.279,90
352;Placa Mãe Goldentec Gaming AMD B550m DDR4 | Gt;R$ 714,12
353;Placa Mae Duex Intel, DDR3, H81 - Dx H81zg M2;R$ 324,90
354;Placa Mãe Gigabyte, Para Intel H510m H, V2, LGA 1200 Ultra Durable, 2x, DDR4, Matx;R$ 659,90
355;Placa Mãe Knup Pci Express Chipset, Intel LGA 1155, DDR3, 16GB, USB 2.0;R$ 391,24
356;Placa-Mãe Msi Pro B550m-P Gen3, AMD AM4, Matx, DDR4, Chipset B550 - 911-7d95-010;R$ 823,90
357;Placa-Mãe Goldentech, Intel, LGA 1151, H310C, DDR4, GT;R$ 452,23
358;Placa-Mãe Biostar, AMD, DDR3, HDMI - A68N-2100K;R$ 399,88
359;Placa-Mãe AsRock, AMD AM3, LGA - 760GM-HD;R$ 741,50
360;Placa Mãe Biostar A520mh, AMD, Am4 MATX, DDR4;R$ 503,67
361;Placa Mãe Goline, Chipset Intel LGA775, DDR3 -  GL-41-MA G41;R$ 399,00
362;Placa-Mãe Goline, Intel 1151, DDR3, VGA e HDMI - GL-H110-MA;R$ 574,00
363;Placa-Mãe Daixu B75M, Intel LGA 1155, DDR3 até 16GB;R$ 549,99
364;Placa-Mãe Gigabyte C621 Aorus Xtreme, Intel LGA 3647, DDR4;R$ 10.744,75
365;Placa-Mãe Positivo Premium, Intel Celeron CPU Onboard, Para Notebook - 6-71-W54T0-D03;R$ 350,00
366;Placa-Mãe Bluecase Bulk, AMD AM3+, mATX, DDR3, 760G - BMB78-D2;R$ 432,00
367;Placa Mãe Gigabyte B660M DS3H, Intel LGA 1700, mATX, DDR4, M.2 NVME;R$ ----
368;Placa Mãe ASUS Prime H510M-A R2.0, Intel, ATX, DDR4, LGA 1200, H470 - 90MB1FP0-M0EAY0;R$ ----
369;Placa Mãe Asus TUF Gaming X670E-Plus Wi-Fi, AMD X670, AM5, DDR5 - 90MB1BK0-M0EAY0;R$ ----
370;Placa Mãe Gigabyte B660M Aorus PRO, Intel LGA 1700, mATX, DDR4, M.2 NVME;R$ ----
371;Placa Mãe Asus ROG STRIX B760-F Gaming Wi-Fi, Intel LGA 1700, ATX, DDR5, Wi-Fi - 90MB1CT0-M0EAY0;R$ ----
372;Placa Mãe Asus Tuf Gaming Z690-Plus D4, Intel 1700 Z690, ATX, DDR4, RGB;R$ ----
373;Placa Mãe Asus TUF Gaming B650M-Plus Wi-Fi, AMD AM5 B650, mATX, DDR5, Wi-Fi - 90MB1BF0-M0EAY0;R$ ----
374;Placa Mãe Asus Prime Z790-A Wi-Fi, Intel LGA1700 Z790, ATX, DDR5 - 90MB1CS0-M0EAY0;R$ ----
375;Placa Mãe Gigabyte H510M, Intel LGA 1200, mATX, DDR4, (rev. 1.0);R$ ----
376;Placa Mãe Z790-P MSI PRO Wi-Fi, Intel LGA 1700, ATX, DDR5 - PRO Z790-P WIFI;R$ ----
377;Placa Mãe Asus TUF Gaming B550M-PLUS Wi-Fi II, AMD, mATX, DDR4, RGB, Wi-Fi - 90MB19Y0-M0EAY0;R$ ----
378;Placa Mãe Gigabyte B650M DS3H (Rev. 1.0), AMD, ATX, DDR5 AM5, RGB - B650M DS3H;R$ ----
379;Placa Mãe Asus Prime B650M-A WiFi II - 90MB1EG0-M0EAY0;R$ ----
380;Placa Mãe Asus Rog Strix B650E-I Gaming WiFi, AMD, Mini-ITX, DDR5, RGB, WiFi, Bluetooth - 90MB1BI0-M0EAY0;R$ ----
381;Placa Mãe Asus Rog Strix B650E-F Gaming WiFi, AMD, ATX, DDR5, RGB, WiFi, Bluetooth - 90MB1BQ0-M0EAY1;R$ ----
382;Placa Mãe Gigabyte B450M Gaming, AMD AM4, mATX, DDR4, (rev. 1.0);R$ ----
383;Placa Mãe Asus TUF GAMING B760M-Plus, Intel LGA 1700, mATX, D4, DDR4 - 90MB1DI0-M0EAY0;R$ ----
384;Placa Mãe Asrock X670E Steel Legend, ATX, AMD Ryzen, DDR5, Wifi, Bluetooth - 90-MXBJ40-A0UAYZ;R$ ----
385;Placa Mãe Asus ROG Strix Z790-I Gaming Wi-Fi, Intel LGA1700 Z790, ITX, DDR5 - 90MB1CM0-M0EAY0;R$ ----
386;Placa Mãe Asus TUF Gaming B660M-PLUS Wi-Fi D4, Intel LGA 1700 B660, mATX, DDR4;R$ ----
387;Placa Mãe Gigabyte Z790 Aorus Elite, LGA 1700, ATX, DDR5 - Z790 AORUS ELITE;R$ ----
388;Placa Mae Asus Prime Z590-P, Intel, mATX, DDR4, RGB - 90MB16I0-M0EAY0;R$ ----
389;Placa Mae Asus TUF Gaming X670E-Plus, AMD X670, AM5, DDR5 - 90MB1BJ0-C1BAY0;R$ ----
390;Placa Mãe Asus Proart Z790 Creator, Intel, ATX, DDR5, WiFi, Bluetooth - 90MB1DV0-M1EAY0;R$ ----
391;Placa Mãe Gigabyte B760M DS3H (rev. 1.0), LGA1700, DDR4;R$ ----
392;Placa Mãe Gigabyte B760 AORUS ELITE AX (rev. 1.0), Intel LGA 1700, ATX, DDR4, WIFI - B760 A ELITE AX DDR4;R$ ----
393;Placa Mãe ASUS ProArt B650-Creator, AMD AM5 B650, ATX, DDR5 - 90MB1C40-M0EAY0;R$ ----
394;Placa-Mãe Asus ROG Crosshair X670E Hero, AMD AM5, ATX, DDR5, Wi-Fi, M.2, USB/4 - 90MB1BC0-M0EAY0;R$ ----
395;Placa-Mãe Asus TUF Gaming, Intel LGA 1200, mATX - B460M-PLUS;R$ ----
396;Placa Mãe Asus Prime X670-P, AMD X670, AM5, DDR5 - 90MB1BU0-M0EAY0;R$ ----
397;Placa Mãe Asus Rog Strix B760-i Gaming WiFi - 90MB1D90-M0EAY0;R$ ----
398;Placa-Mãe Goldentec G41, Intel LGA 755, Micro ATX, DDR3 - 43766;R$ ----
399;Placa Mãe Asus TUF Gaming B650M-Plus, AMD AM5 B650, mATX, DDR5 - 90MB1BG0-M0EAY0;R$ ----
400;Placa Mãe Asus Prime X570-Pro, AMD AM4, ATX, DDR4;R$ ----
401;Placa Mãe Gigabyte B650M Gaming X AX, AMD, ATX, AM5, DDR5, Wi-Fi, Bluetooth - B650M GAMING X AX;R$ ----
402;Placa-Mãe ASRock A520M-HVS, AMD AM4, Micro ATX, DDR4;R$ ----
403;Placa Mãe Gigabyte B560M DS3H V2, Intel LGA1200, Micro ATX, DDR4, (rev. 1.0);R$ ----
404;Placa Mãe Asus Prime B760M-A, Intel LGA 1700, D4, mATX, DDR4 - 90MB1D00-M0EAY0;R$ ----
405;Placa Mãe Asus ROG Strix B550-F Gaming, AMD AM4, ATX, DDR4;R$ ----
406;Placa Mãe Asus ROG STRIX B760-A GAMING WIFI, Intel, ATX, DDR5, Wi-Fi, Bluetooth - 90MB1EP0-M0EAY0;R$ ----
407;Placa Mãe Asus ROG Strix B650E-E Gaming Wi-Fi, AMD AM5 B650, ATX, DDR5, Wi-Fi - 90MB1BB0-M0EAY0;R$ ----
408;Placa Mãe Gigabyte H410M H V3, Intel LGA 1200, mATX, DDR4, (rev. 1.0);R$ ----
409;Placa Mãe Asus Rog Crosshair X670E Hero, AMD X670, AM5, DDR5, Wi-Fi - 90MB1BC0-M0EAY0;R$ ----
410;Placa Mãe Gigabyte B660M Gaming X, Intel 1700, mATX, DDR4;R$ ----
411;Placa Mãe Asus Tuf Gaming Z790-Plus, Intel, ATX, DDR5, RGB, Wi-Fi, Bluetooth - 90MB1D80-M1EAY0;R$ ----
412;Placa Mãe Gigabyte B650M Aorus Elite, AMD, Micro ATX, DDR5 - B650M AORUS ELITE;R$ ----
413;Placa Mae Asus ROG Maximus Z790 Hero, Intel LGA1700 Z790, ATX, DDR5, Wi-Fi - 90MB1CI0-M0EAY0;R$ ----
414;Placa Mãe Asus ROG Strix Z490-I Gaming, Intel LGA 1200, Mini-ITX, DDR4;R$ ----
415;Placa Mãe Asus Prime X670-P Wi-Fi, AMD X670, AM5, DDR5 - 90MB1BV0-M0EAY0;R$ ----
416;Placa Mãe Asus Prime B450M-Gaming II, Micro ATX, AMD AM4, DDR4 - 90MB17W0-C1BAY0;R$ ----
417;Placa Mãe Gigabyte B660M Aorus PRO AX, Intel LGA1700, Micro ATX, DDR5,  Wi-Fi, Bluetooth, (rev. 1.x);R$ ----
418;Placa Mãe Gigabyte A620M DS3H, AMD AM5, mATX, DDR5, RGB;R$ ----
419;Placa Mãe Gigabyte GA-A320M-S2H, AMD AM4, mATX, DDR4;R$ ----
420;Placa Mãe Gigabyte Z590M Gaming X, LGA 1200, Micro ATX, DDR4, (rev. 1.0);R$ ----
421;Placa Mãe Asus Prime H410M-E, Intel LGA 1200, mATX, DDR4;R$ ----
422;Placa Mãe MSI Mortar, AMD AM4, mATX, DDR4 - MAG B550M MORTAR;R$ ----
423;Placa Mãe Gigabyte A520M S2H, AMD AM4, DDR4;R$ ----
424;Placa Mãe Gigabyte Z690 Gaming X, Intel LGA 1700, ATX, DDR5, M.2 NVMe;R$ ----
425;Placa Mãe ASUS PRIME Z790M-PLUS, Intel LGA 1700, mATX, DDR5, RGB - 90MB1E70-M0EAY0;R$ ----
426;Placa Mãe Asus ROG Strix B550-F Gaming II, AMD AM4, ATX, DDR4, Wi-Fi, Aura Sync RGB;R$ ----
427;Placa Mae Asus ProArt X670E-Creator Wi-Fi, AMD X670, AM5, DDR5 - 90MB1B90-M0EAY0;R$ ----
428;Placa Mãe Asus TUF Gaming B560M-PLUS, Intel LGA1200, microATX, DDR4;R$ ----
429;Placa Mãe Z790 MSI MAG Tomahawk Wi-Fi, Intel LGA 1700, ATX, DDR4 - MAG Z790 TOMAHAWK WIFI DDR4;R$ ----
430;Placa Mãe Goldentec H61, Intel LGA 1155, Micro ATX, DDR3 - 43764;R$ ----
431;Placa Mãe Asus Prime Z690-A, Intel 1700, DDR5, ATX, RGB;R$ ----
432;Placa Mae Asus Rog Strix X670E-I Gaming Wi-Fi, AMD X670, AM5, DDR5 - 90MB1B70-M0EAY0;R$ ----
433;Placa Mãe Asus Prime B760-Plus, Intel LGA 1700, D4,DDR4, ATX - 90MB1CW0-M0EAY0;R$ ----
434;Placa Mãe Asus Prime B650-Plus, AMD AM5 B650, ATX, DDR5 - 90MB1BS0-M0EAY0;R$ ----
435;Placa Mãe Asus Prime H610M-A D4, LGA 1700 H610, mATX, DDR4;R$ ----
436;Placa Mãe MSI B560M PRO-VDH, Intel LGA 1200, MATX, DDR4;R$ ----
437;Placa Mãe Asus ROG Strix B660-F Gaming Wi-Fi, Intel LGA 1700 B660, ATX, DDR5;R$ ----
438;Placa Mãe Gigabyte B450M Aorus Elite, AMD AM4, Micro ATX, DDR4;R$ ----
439;Placa Mãe ASUS ROG Strix B550-A Gaming, AMD B550, ATX, DDR4;R$ ----
440;Placa Mãe Asus Prime B560M-A, Intel LGA1200, mATX, DDR4;R$ ----
441;Placa Mãe MSI B450M Pro-M2 Max, AMD AM4, m-ATX, DDR4;R$ ----
442;Placa Mãe Gigabyte Aorus B450 Aorus M, AMD AM4, mATX, DDR4;R$ ----
443;Placa Mãe ASRock B660M Phantom Gaming 4, Intel, M-ATX, DDR4, Socket, LGA 1700;R$ ----
444;Placa Mãe ASRock H510M-HDV/M.2, Intel LGA1200, mATX, DDR4;R$ ----
445;Placa Mãe Asus Rog Maximus Z790 Apex, Intel, ATX, DDR5, RGB, WiFi, Bluetooth, LGA 1700 - 90MB1CF0-M0EAY0;R$ ----
446;Placa-Mãe Gigabyte A520, AMD AM4, DDR4 - A520M-H;R$ ----
447;Placa-Mãe Asus ROG Strix X570-F Gaming, AMD AM4, ATX, DDR4;R$ ----
448;Placa Mãe Gigabyte H410M S2H V3, Intel LGA 1200, mATX, DDR4, (rev. 1.0);R$ ----
449;Placa Mãe Asus Prime H310M-E R2.0/BR, Intel LGA 1151, mATX, DDR4;R$ ----
450;Placa-Mãe ASRock Z690 Taichi, Intel LGA 1700, ATX, DDR5, M.2 NVMe, Wi-Fi, Bluetooth - Z690 Taichi;R$ ----
451;Placa Mãe Gigabyte B760 Aorus Master (rev. 1.0), Intel, ATX, DDR4, Wi-Fi, Bluetooth - B760 AORUS MASTER DDR4;R$ ----
452;Placa Mãe Gigabyte B550M Gaming, AMD AM4, Micro ATX, DDR4;R$ ----
453;Placa Mãe Gigabyte B760M Gaming X (rev. 1.0),  Intel, Micro ATX, DDR4 - B760M GAMING X DDR4;R$ ----
454;Placa Mãe MSI PRO H410M-B, LGA1200, mATX, DDR4;R$ ----
455;Placa Mãe ASRock H310CM-HG4, Intel LGA 1151, mATX, DDR4;R$ ----
456;Placa Mãe Gigabyte Z590 Aorus Ultra Wi-Fi, LGA 1200, ATX, DDR4, (rev. 1.0);R$ ----
457;Placa-Mãe ASRock Z690 Extreme, Intel LGA 1700, ATX, DDR4, M.2 NVMe - Z690 EXTREME;R$ ----
458;Placa Mãe Asus TUF GAMING B760M-Plus Wi-Fi, Intel LGA 1700, mATX, D4,DDR4, Wi-Fi - 90MB1DG0-M0EAY0;R$ ----
459;Placa Mãe Gigabyte B550 Aorus Master, AMD AM4, ATX, DDR4;R$ ----
460;Placa Mãe MSI PRO B660M-A, LGA 1700, mATX, DDR4 - 911-7D43-004;R$ ----
461;Placa Mãe ASRock B560M Steel Legend, Intel LGA 1200, Micro ATX, DDR4;R$ ----
462;Placa Mãe Asus Rog Strix Z790-A Gaming Wi-Fi D4, Intel, ATX, DDR5, Wi-Fi, Bluetooth - 90MB1E00-M0EAY0;R$ ----
463;Placa Mãe Gigabyte B660M Gaming X DDR4, Intel, mATX, DDR4 - B660MGAMINGXDDR4;R$ ----
464;Placa Mãe Asus TUF Gaming B650-Plus, AMD AM5 B650, ATX, DDR5 - 90MB1BY0-M0EAY0;R$ ----
465;Placa Mãe Asus TUF GAMING Z690-PLUS WIFI D4, Intel, ATX, DDR4, RGB, Wi-Fi;R$ ----
466;Placa Mãe Gigabyte Z690 Gaming X DDR4, Intel LGA 1700, ATX, DDR4, M.2 NVME, (rev. 1.0);R$ ----
467;Placa Mãe Asus ROG MAXIMUS Z690 EXTREME, Intel 1700 Z690, DDR5, EATX;R$ ----
468;Placa Mãe Gigabyte Z590 Aorus Master, Intel LGA1200, ATX, DDR4, Wi-Fi, RGB, Bluetooth, (rev. 1.0);R$ ----
469;Placa Mãe Asus TUF Gaming Z490-Plus, Intel LGA 1200, ATX, DDR4;R$ ----
470;Placa Mãe Gigabyte B760 GAMING X AX (rev. 1.0), LGA 1700, Wifi, DDR4;R$ ----
471;Placa Mãe NZXT N5 Z690, Intel Z690, ATX, DDR4, Wifi, Bluetooth, Preto - N5-Z69XT-B1;R$ ----
472;Placa Mãe Asus Prime Z690-P Wi-Fi, Intel 1700 Z690, DDR5, ATX;R$ ----
473;Placa Mãe Gigabyte Z590M, Intel LGA 1200, Micro ATX, DDR4, RGB Fusion 2.0, (rev. 1.0);R$ ----
474;Placa Mãe Asus TUF Gaming X570-Plus/BR, AMD AM4, ATX, DDR4;R$ ----
475;Placa Mãe Gigabyte Z690M Aorus Elite, Intel LGA 1700, mATX, DDR4, M.2 NVMe, (rev. 1.0);R$ ----
476;Placa Mãe Gigabyte B560M Aorus Elite, LGA 1200, Micro ATX, DDR4, (rev. 1.0);R$ ----
477;Placa Mãe Gigabyte B450M DS3H, AMD, mATX, DDR4;R$ ----
478;Placa Mãe Asus Rog Crosshair X670E Gene, AMD X670, AM5, DDR5, Wi-Fi - 90MB1B80-M0EAY0;R$ ----
479;Placa Mãe Galax B550M EX, AMD AM4, M-ATX, DDR4;R$ ----
480;Placa-Mãe ASRock Z690 Steel Legend/D5, Intel LGA 1700, ATX, DDR5, M.2 NVMe - Z690 Steel Legend/D5;R$ ----
481;Placa Mãe Gigabyte H410M H, Intel LGA 1200, Micro ATX, DDR4;R$ ----
482;Placa Mãe Asus TUF Gaming B450M-Pro II, AMD AM4, mATX, DDR4;R$ ----
483;Placa Mãe NZXT N5 Z690, Intel Z690, ATX, DDR4, Wifi, Bluetooth, Branco - N5-Z69XT-W1;R$ ----
484;Placa Mãe Gigabyte A520M H, AMD A520, mATX, DDR4, (rev. 1.0);R$ ----
485;Placa Mãe Asus Rog Strix X670E-A Gaming Wi-Fi, AMD X670, AM5, DDR5 - 90MB1BM0-M0EAY0;R$ ----
486;Placa Mãe Asus TUF GAMING H770-PRO WIFI, Intel, ATX, DDR5, Wi-Fi, Bluetooth - 90MB1D50-M0EAY0;R$ ----
487;Placa Mãe Z790-P MSI PRO, Intel LGA 1700, ATX, DDR4 - PRO Z790-P DDR4;R$ ----
488;Placa Mãe Gigabyte H610M (rev. 1.0), Intel LGA1700, H610, DDR4, mATX - H610M H DDR4;R$ ----
489;Placa Mãe Gigabyte Z690 Aorus Elite AX, Intel LGA 1700, ATX, DDR4, M.2 NVMe, Wi-Fi, (rev. 1.0);R$ ----
490;Placa Mãe Gigabyte H610M S2H, Intel LGA1700, Micro ATX, DDR4, (rev. 1.1);R$ ----
491;Placa Mãe Gigabyte GA-A320M-H, AMD AM4, mATX, DDR4, (rev. 1.2);R$ ----
492;Placa Mãe Gigabyte B550M H, AMD AM4, Micro ATX, DDR4;R$ ----
493;Placa Mae ASRock B660M-HDV, Intel LGA 1700, ATX, DDR4, M.2 NVMe - B660M-HDV;R$ ----
494;Placa Mãe MSI PRO H610M-B DDR4, LGA1700, mATX, DDR4;R$ ----
495;Placa Mãe Asus TUF Gaming B660M-PLUS D4, Intel LGA 1700, mATX, DDR4, RGB;R$ ----
496;Placa Mãe B650 MSI MAG Tomahawk Wi-Fi, AMD AM5, ATX, DDR5 - MAG B650 TOMAHAWK WIFI;R$ ----
497;Placa Mãe Asus ROG Strix Z790-E Gaming Wi-Fi, Intel LGA1700 Z790, ATX, DDR5 - 90MB1CL0-M0EAY0;R$ ----
498;Placa Mãe MSI MAG B550 Tomahawk, AMD AM4, ATX, DDR4;R$ ----
499;Placa Mãe Asus Prime H510M-E, Intel LGA 1200, microATX, DDR4;R$ ----
500;Placa Mãe Asus ROG Strix Z690-A Gaming Wi-Fi D4, Intel 1700 Z690, DDR4, ATX, RGB, Wi-Fi, Bluetooth;R$ ----
501;Placa Mãe Asus TUF Gaming B460M-Plus, Intel LGA1200, mATX, DDR4;R$ ----
502;Placa Mãe MSI B560M-A PRO, Intel LGA 1200, Intel B560, mATX, DDR4;R$ ----
503;Placa Mãe Gigabyte H310M M.2, Intel LGA 1151, mATX, DDR4;R$ ----
504;Placa Mãe MSI MAG B660M Bazooka, Intel LGA 1700, mATX, DDR4 - MAG B660M BAZOOKA DDR4;R$ ----
505;Placa Mãe Gigabyte Z790 Aourus Master, Intel LGA 1700, E-ATX, DDR5, Wi-Fi, Bluetooth  - Z790 AORUS MASTER;R$ ----
506;Placa-Mãe Asus TUF Gaming, AMD AM4, ATX, DDR4, USB 3.1, Slot M.2 - X570-PLUS/BR;R$ ----
507;Placa Mãe Gigabyte B660M DS3H AX, Intel LGA 1700, mATX, DDR4, M.2 NVME, Wi-Fi;R$ ----
508;Placa Mãe Duex B550M, AMD AM4, mATX, DDR4 - DX B550ZG M2;R$ ----
509;Placa Mae Asus ROG Strix X670E-F Gaming Wi-Fi, AMD X670, AM5, DDR5 - 90MB1BA0-M0EAY0;R$ ----
510;Placa Mãe MSI H310M Pro-VDH Plus, Intel LGA 1151, m-ATX, DDR4;R$ ----
511;Placa Mãe ASRock B560M-HDV, Intel LGA 1200, Micro ATX, DDR4;R$ ----
512;Placa Mãe Asus Prime B550M-K, AMD AM4, mATX, DDR4;R$ ----
513;Placa Mãe Asus Prime H510M-A, Intel Socket LGA1200, microATX, DDR4;R$ ----
514;Placa Mãe Asus Prime B760M-A Wi-Fi, Intel LGA 1700, mATX, D4,DDR4, Wi-Fi - 90MB1CX0-M0EAY0;R$ ----
515;Placa Mãe Asus TUF Gaming H310M-Plus/BR, Intel LGA 1151, mATX, DDR4;R$ ----
516;Placa Mãe MSI Bazooka, Intel LGA 1200, mATX, DDR4 - MAG B560M BAZOOKA;R$ ----
517;Placa Mãe Asus ROG Crosshair VIII Hero Wi-Fi, AMD AM4, ATX, DDR4;R$ ----
518;Placa Mãe ASRock H510M-HVS, Intel LGA1200, mATX, DDR4 (rev. 2.0);R$ ----
519;Placa Mãe Goldentec H81M SQBOX, Intel LGA 1150, Micro ATX, DDR3 - 43765;R$ ----
520;Placa Mãe MSI Mag B760 Tomahawk, Intel LGA 1700, ATX, DDR4, Wi-Fi, Bluetooth - MAG B760 TOMAHAWK WIFI DDR4;R$ ----
521;Placa Mãe Asus ROG STRIX B760-G GAMING WIFI, Intel, mATX, DDR5, Wi-Fi, Bluetooth - 90MB1EQ0-M0EAY0;R$ ----
522;Placa Mãe Gigabyte Z690 Aorus Ultra, Intel LGA 1700, ATX, DDR5, M.2 NVME, Wi-Fi (rev. 1.0);R$ ----
523;Placa Mãe Gigabyte AORUS Z790 XTREME X, Intel, E-ATX, DDR5, RGB, Wi-Fi, Bluetooth - Z790 AORUS XTREME X;R$ ----
524;Placa Mãe ASRock A320M-HD R4, AMD AM4, Micro ATX, DDR4;R$ ----
525;Placa Mãe Asus ROG Strix B660-A Gaming Wi-Fi D4, Intel LGA 1700 B660, ATX, DDR4;R$ ----
526;Placa-Mãe ASRock Z690 Phantom Gaming 4/D5, Intel LGA 1700, ATX, DDR5, M.2 NVMe - Z690 Phantom Gaming 4/D5;R$ ----
527;Placa Mãe Asus ROG Strix B650-A Gaming Wi-Fi, AMD AM5 B650, ATX, DDR5, Wi-Fi - 90MB1BP0-M0EAY0;R$ ----
528;Placa Mãe Asus Prime H570M-PLUS, Intel Socket LGA1200, microATX, DDR4;R$ ----
529;Placa Mãe MSI, Intel LGA 1700, mATX, DDR4 - PRO B660M-P DDR4;R$ ----
530;Placa Mãe NZXT N7 B550, AMD AM4, ATX, DDR4, Wi-Fi, Bluetooth, Branco - N7-B55XT-W1;R$ ----
531;Placa Mãe Asus Rog Strix X670E-E Gaming Wi-Fi, AMD X670, AM5, DDR5 - 90MB1BR0-M0EAY0;R$ ----
532;Placa Mãe Gigabyte Z490M Gaming X, Intel LGA 1200, mATX, DDR4;R$ ----
533;Placa Mãe Aorus B550M Pro-P, AMD B550, Micro ATX, DDR4 (rev. 1.0);R$ ----
534;Placa Mãe Galax B550M, AMD AM4, M-ATX, DDR4;R$ ----
535;Placa Mãe Asus TUF Gaming B650-Plus Wi-Fi, AMD AM5 B650, ATX, DDR5, Wi-Fi - 90MB1BZ0-M0EAY0;R$ ----
536;Placa Mãe Asus Prime X670E-Pro Wi-Fi, AMD X670, AM5, DDR5 - 90MB1BL0-M0EAY0;R$ ----
537;Placa Mãe Asus ROG Strix Z590-E Gamimg Wi-Fi, Intel LGA1200, ATX, DDR4, RGB Aura Sync;R$ ----
538;Placa-Mãe Gigabyte X670 Aorus Elite Ax, AMD Am5, ATX, DDR5;R$ ----
539;Placa Mãe Gigabyte Z590 Vision D, Intel LGA1200, ATX, DDR4, M.2 NVME, Wi-Fi, Bluetooth, (rev. 1.0);R$ ----
540;Placa Mãe Gigabyte Z590 UD, Intel LGA 1200, ATX, DDR4, M.2 NVMe, (rev. 1.0);R$ ----
541;Placa Mãe Gigabyte B660 A Master, Intel LGA 1700, ATX, DDR4, M.2 NVME, Wi-Fi;R$ ----
542;Placa Mãe Gigabyte X570S Aorus Elite AX, AMD AM4, ATX, DDR4, LED RGB, Wi-Fi, Bluetooth, (rev. 1.1);R$ ----
543;Placa Mãe ASRock B550M Pro4, AMD AM4, Micro ATX, DDR4;R$ ----
544;Placa Mãe Gigabyte B560M Gaming HD, Intel LGA 1200, Micro ATX, RGB, (rev. 1.0);R$ ----
545;Placa Mãe Asus TUF Gaming B660-PLUS Wi-Fi D4, Intel LGA 1700 B660, ATX, DDR4;R$ ----
546;Placa Mãe ASRock B560M Pro4, Intel LGA 1200, Micro ATX, DDR4;R$ ----
547;Placa Mãe Asus TUF GAMING B560M-PLUS WIFI, Intel LGA1200, microATX, DDR4 - 90MB1770-M0EAY0;R$ ----
548;Placa Mãe Gigabyte Z690 Aorus Pro, Intel LGA 1700, ATX, DDR5, M.2 NVME, (rev. 1.0);R$ ----
549;Placa Mãe Gigabyte X570S Aorus Elite, AMD AM4, ATX, DDR4, LED RGB, (rev. 1.0);R$ ----
550;Placa Mãe Asus ROG Strix Z690-F Gaming Wi-Fi, Intel 1700, DDR5, ATX, RGB, Wi-Fi, Bluetooth;R$ ----
551;Placa Mãe Asus Prime B450M Gaming/BR, AMD AM4, mATX, DDR4;R$ ----
552;Placa Mãe Gigabyte B560M Aorus Pro, Intel LGA1200, Micro ATX, DDR4, RGB, (rev. 1.0);R$ ----
553;Placa Mãe MSI MEG Z590 Unify, Intel LGA 1200, ATX, DDR4, Wi-Fi;R$ ----
554;Placa Mãe MSI MAG B550M Bazooka, AMD AM4, mATX, DDR4;R$ ----
555;Placa Mãe Gigabyte B660M Aorus PRO, Intel LGA1700, DDR5, mATX, (rev. 1.0);R$ ----
556;Placa Mãe ASRock B550 Pro4, AMD AM4, ATX, DDR4;R$ ----
557;Placa Mãe Asus TUF GAMING A620M-PLUS WIFI, AMD AM5, mATX, DDR5, Wi-Fi, Bluetooth - 90MB1F00-M0EAY0;R$ ----
558;Placa Mãe Asus Prime Z690-P D4, Intel LGA 1700, ATX, DDR4;R$ ----
559;Placa Mãe MSI MAG Z490 Tomahawk, Intel LGA 1200, ATX, DDR4;R$ ----
560;Placa Mãe Gigabyte B450M S2H, AM4, mATX, DDR4;R$ ----
561;Placa Mãe Asus Prime H670 Plus D4, LGC 1700 H670, ATX, DDR4;R$ ----
562;Placa Mãe Gigabyte Z690 Aorus Elite, Intel LGA 1700, ATX, DDR5, M.2 NVMe;R$ ----
563;Placa Mãe Asus TUF Gaming Z590-PLUS Wi-Fi, Intel Z590 LGA1200, DDR4, ATX;R$ ----
564;Placa Mãe Asus Prime A320M-K/BR, AMD AM4, mATX, DDR4;R$ ----
565;Placa Mãe Gigabyte Z390 M Gaming (rev. 1.0), Intel LGA 1151, mATX, DDR4;R$ ----
566;Placa Mãe Gigabyte Aorus B360M Aorus Gaming 3, Intel LGA 1151, mATX, DDR4;R$ ----
567;Placa Mãe MSI H510M-A PRO, Intel LGA1200, mATX, DDR4;R$ ----
568;Placa Mãe Asus TUF Gaming H670-PRO Wi-Fi D4, LGA 1700 H670, ATX, DDR4;R$ ----
569;Placa Mãe Aorus B550 Elite V2, AMD B550, ATX, DDR4, (rev. 1.0);R$ ----
570;Placa Mãe Asus ROG MAXIMUS Z690 HERO, Intel 1700 Z690, DDR5, ATX;R$ ----
571;Placa Mãe Gigabyte Z590 Aorus Elite, LGA 1200, ATX, DDR4, (rev. 1.0);R$ ----
572;Placa Mãe Gigabyte B660M A PRO AX, Intel LGA 1700, mATX, DDR4, M.2 NVME, Wi-Fi;R$ ----
573;Placa Mãe Gigabyte Z690 Aero D, Intel LGA 1700, ATX, DDR5, M.2 NVME, Wi-Fi, (rev. 1.0);R$ ----
574;Placa Mãe H61 Bluecase Bmbh61-g2hg-m2 10/100/1000, Com Slot M2;R$ ----
575;Placa Mãe ASRock A320M-HD, AMD AM4, mATX, DDR4;R$ ----
576;Placa Mãe Asus EX-A320M-Gaming, AMD AM4, mATX, DDR4;R$ ----
577;Placa Mãe Asus TUF B360M-Plus Gaming/BR, Intel LGA 1151, mATX, DDR4;R$ ----
578;Placa Mãe Asus ROG Strix B450-F Gaming, AMD AM4, ATX, DDR4;R$ ----
579;Placa Mãe Asus Prime B450M-A, AMD AM4, mATX, DDR4;R$ ----
580;Placa Mãe Gigabyte Aorus B450 Aorus Pro Wi-Fi, AMD AM4, ATX, DDR4;R$ ----
581;Placa Mãe Asus B150M-C D3/BR, Intel LGA1151, mATX, DDR3;R$ ----
582;Placa Mãe ASRock B450 Gaming K4, AMD AM4, ATX, DDR4;R$ ----
583;Placa Mãe Asus TUF B450M-Plus Gaming, AMD AM4, mATX, DDR4;R$ ----
584;Placa-Mãe Asus TUF B450-Plus Gaming, AMD AM4, ATX, DDR4;R$ ----
585;Placa Mãe Gigabyte Aorus B450 Aorus Pro, AMD AM4, ATX, DDR4;R$ ----
586;Placa Mãe Gigabyte Aorus B450 Aorus Elite, AMD ATX, DDR4;R$ ----
587;Placa Mãe Gigabyte H310M H 2.0, Intel LGA 1151, mATX, DDR4, (rev. 1.0);R$ ----
588;Placa Mãe Gigabyte H310M DS2 2.0, Intel LGA 1151, mATX, DDR4;R$ ----
589;Placa Mãe Gigabyte GA-AB350M-DS3H V2, AMD AM4, mATX, DDR4;R$ ----
590;Placa Mãe Gigabyte H310M M.2 2.0, Intel LGA 1151, mATX, DDR4;R$ ----
591;Placa Mãe Asrock X570 PRO4, AMD AM4, ATX, DDR4;R$ ----
592;Placa Mãe Asrock X570 Phantom Gaming 4, AMD AM4, ATX, DDR4;R$ ----
593;Placa Mãe Asrock ASRock X570 Steel Legend, AMD AM4, ATX, DDR4;R$ ----
594;Placa Mãe Asus EX-B365M-V5, Intel LGA 1151, mATX, DDR4;R$ ----
595;Placa Mãe Gigabyte Aorus X570 Aorus Ultra, AMD AM4, ATX, DDR4;R$ ----
596;Placa Mãe Gigabyte Aorus X570 Aorus Elite, AMD AM4, ATX, DDR4;R$ ----
597;Placa Mãe Gigabyte Aorus X570 Aorus Pro Wi-Fi, AMD AM4, ATX, DDR4, (rev 1.0);R$ ----
598;Placa Mãe Gigabyte X570 Gaming X, AMD AM4, ATX, DDR4;R$ ----
599;Placa Mãe Gigabyte H310M S2P 2.0, Intel LGA 1151, mATX, DDR4;R$ ----
600;Placa Mãe MSI B365M PRO-VDH, Intel LGA-1151, mATX, DDR4;R$ ----
601;Placa Mãe Gigabyte B365M DS3H, Intel LGA 1151, mATX, DDR4;R$ ----
602;Placa Mãe Gigabyte B450 Gaming X, AM4, ATX, DDR4;R$ ----
603;Placa Mãe Gigabyte Aorus X570 Aorus Pro, AM4, ATX, DDR4;R$ ----
604;Placa Mãe ASRock X570 Extreme4, AMD AM4, ATX, DDR4;R$ ----
605;Placa Mãe ASRock X570 Phantom Gaming 4S, AMD AM4, ATX, DDR4;R$ ----
606;Placa Mãe Asus TUF Gaming Z490-Plus Wi-Fi, Intel LGA 1200, ATX, DDR4;R$ ----
607;Placa Mãe Asus Prime Z490-P, Intel LGA 1200, ATX, DDR4;R$ ----
608;Placa Mãe Asus Prime Z490M-Plus, Intel LGA 1200, mATX, DDR4;R$ ----
609;Placa Mãe ASRock B365M Pro4-F, Intel LGA1151, mATX, DDR4;R$ ----
