ID;Descrição;Preço em R$
610;Placa Mãe Gigabyte Aorus Z490 Aorus Ultra, Intel LGA1200, ATX, DDR4, (rev 1.0);R$ ----
611;Placa Mãe Gigabyte Aorus Z490 Aorus Elite, Intel LGA 1200, ATX, DDR4;R$ ----
612;Placa Mãe Gigabyte Aorus Z490 Aorus Elite AC, Intel LGA 1200, ATX, DDR4;R$ ----
613;Placa Mãe Gigabyte Z490 Gaming X, Intel LGA 1200, ATX, DDR4;R$ ----
614;Placa Mãe Gigabyte Aorus Z490 Aorus PRO AX, Intel LGA 1200, ATX, DDR4;R$ ----
615;Placa Mãe Gigabyte Z490 Vision D, Intel LGA 1200, ATX, DDR4;R$ ----
616;Placa Mãe Gigabyte Z490 Vision G, Intel LGA 1200, ATX, DDR4;R$ ----
617;Placa Mãe Gigabyte Z490M, Intel LGA 1200, mATX, DDR4;R$ ----
618;Placa Mãe Gigabyte Z490 UD, Intel LGA 1200, ATX, DDR4;R$ ----
619;Placa Mãe Asus Prime H410M-A, Intel LGA 1200, mATX, DDR4;R$ ----
620;Placa Mãe Asus EX-B460M-V5, Intel LGA 1200, mATX, DDR4;R$ ----
621;Placa Mãe Asus ROG Strix B460-F Gaming, Intel LGA 1200, ATX, DDR4;R$ ----
622;Placa Mãe Asus ROG Strix B460-H Gaming, Intel LGA 1200, ATX, DDR4;R$ ----
623;Placa Mãe Asus ROG Strix B460-G Gaming, Intel LGA 1200, mATX, DDR4;R$ ----
624;Placa Mãe Asus ROG Maximus XII Extreme, Intel LGA 1200, eATX, DDR4;R$ ----
625;Placa Mãe Asus ROG Maximus XII Formula, Intel LGA 1200, ATX, DDR4;R$ ----
626;Placa Mãe Asus ROG Maximus XII Hero Wi-Fi, Intel LGA 1200, ATX, DDR4;R$ ----
627;Placa Mãe Asus ROG Strix Z490-F Gaming, Intel LGA 1200, ATX, DDR4;R$ ----
628;Placa Mãe Asus ROG Strix Z490-A Gaming, Intel LGA 1200, ATX, DDR4;R$ ----
629;Placa Mãe Asus ROG Strix Z490-G Gaming Wi-Fi, Intel LGA 1200, mATX, DDR4;R$ ----
630;Placa Mãe Asus Prime Z490-A, Intel LGA 1200, ATX, DDR4;R$ ----
631;Placa Mãe Asus ROG Strix Z490-H Gaming, Intel LGA 1200, ATX, DDR4;R$ ----
632;Placa Mãe MSI MEG Z490 Ace, Intel LGA 1200, ATX, DDR4;R$ ----
633;Placa Mãe MSI MPG Z490 Gaming Carbon Wi-Fi, Intel LGA 1200, ATX, DDR4;R$ ----
634;Placa Mãe Asus ROG STRIX Z490-G Gaming, Intel LGA 1200, mATX, DDR4;R$ ----
635;Placa Mãe Asus TUF Gaming B460M-Plus Wi-Fi, Intel LGA 1200, mATX, DDR4;R$ ----
636;Placa Mãe ASRock Z490 Taichi, Intel LGA 1200, ATX, DDR4;R$ ----
637;Placa Mãe ASRock Z490 PG Velocita, Intel LGA 1200, ATX, DDR4;R$ ----
638;Placa Mãe ASRock Z490 Steel Legend, Intel LGA 1200, ATX, DDR4 - 90-MXBC10-A0UAYZ;R$ ----
639;Placa Mãe ASRock Z490 Phantom Gaming 4, Intel LGA 1200, ATX, DDR4 - 90-MXBC60-A0UAYZ;R$ ----
640;Placa Mãe ASRock B460 Phantom Gaming 4, Intel LGA 1200, ATX, DDR4;R$ ----
641;Placa Mãe ASRock B460M-HDV, Intel LGA 1200, Micro ATX, DDR4;R$ ----
642;Placa Mãe Gigabyte B460 HD3, Intel LGA 1200, ATX, DDR4;R$ ----
643;Placa Mãe Aorus B460M Aorus Pro, Intel LGA 1200, mATX, DDR4;R$ ----
644;Placa Mãe Gigabyte B460M D3H, Intel LGA 1200, mATX, DDR4;R$ ----
645;Placa Mãe Gigabyte B460M DS3H, Intel LGA 1200, mATX, DDR4;R$ ----
646;Placa Mãe Gigabyte B460M Gaming HD, Intel LGA 1200, mATX, DDR4;R$ ----
647;Placa Mãe Asus TUF Gaming B550-Plus, AMD AM4, ATX, DDR4;R$ ----
648;Placa Mãe Asus TUF Gaming B550M-Plus Wi-Fi, AMD AM4, mATX, DDR4;R$ ----
649;Placa Mãe Asus Prime B550M-A Wi-Fi, AMD AM4, mATX, DDR4;R$ ----
650;Placa Mãe Asus Prime B460M-A, Intel LGA 1200, mATX, DDR4;R$ ----
651;Placa Mãe MSI MAG B460 Tomahawk, Intel LGA 1200, ATX, DDR4;R$ ----
652;Placa Mãe Gigabyte H470 Aorus Pro AX, Intel LGA1200, ATX, DDR4;R$ ----
653;Placa Mãe Gigabyte B460 Aorus Pro AC, Intel LGA1200, ATX, DDR4;R$ ----
654;Placa Mãe Gigabyte B550M S2H, AMD AM4, Micro ATX, DDR4;R$ ----
655;Placa Mãe Gigabyte B450M DS3H Wi-Fi, AMD AM4, Micro ATX, DDR4;R$ ----
656;Placa Mãe Gigabyte B450M H, AMD AM4, Micro ATX, DDR4;R$ ----
657;Placa Mãe ASRock Z490 Pro4, Intel LGA1200, ATX, DDR4;R$ ----
658;Placa Mãe ASRock B460M Steel Legend, Intel LGA1200, Micro ATX, DDR4;R$ ----
659;Placa Mãe ASRock B550 Steel Legend, AMD AM4, ATX, DDR4;R$ ----
660;Placa Mãe ASRock B550M Steel Legend, AMD AM4, Micro ATX, DDR4;R$ ----
661;Placa Mãe ASRock A320M-HDV R4.0, AMD AM4, Micro ATX, DDR4;R$ ----
662;Placa Mãe ASRock B550M-HDV, AMD AM4, Micro ATX, DDR4;R$ ----
663;Placa Mãe Asus TUF Gaming A520M-Plus, AMD AM4, mATX, DDR4;R$ ----
664;Placa Mãe Asus Prime A520M-A, AMD AM4, mATX, DDR4;R$ ----
665;Placa Mãe Asus Prime A520M-K, AMD AM4, mATX, DDR4;R$ ----
666;Placa Mãe ASRock H310CM-HDV, Intel LGA 1151, Micro ATX, DDR4;R$ ----
667;Placa Mãe Asus Prime B460M-K, Intel B460, mATX, DDR4;R$ ----
668;Placa Mãe ASRock A520M-HDVP, AMD AM4, Micro ATX, DDR4;R$ ----
669;Placa Mãe Gigabyte A520 Aorus Elite, AMD AM4, ATX, DDR4;R$ ----
670;Placa Mãe Gigabyte A520M Aorus Elite, AMD AM4, DDR4;R$ ----
671;Placa Mãe Gigabyte B450M S2H V2, AM4, Micro ATX, DDR4, (rev. 1.0);R$ ----
672;Placa Mãe ASRock Z590 PG Velocita, Intel LGA1200, ATX, DDR4, Wi-Fi, Bluetooth, Polychrome RGB Sync;R$ ----
673;Placa Mãe ASRock Z590M Phantom Gaming 4, Intel LGA 1200, Micro ATX, DDR4;R$ ----
674;Placa Mãe ASRock H570M Pro4, Intel LGA 1200, Micro ATX, DDR4;R$ ----
675;Placa Mãe ASRock, AMD AM4, Micro ATX, DDR4, Polychrome Sync RGB;R$ ----
676;Placa Mãe Galax A320M, AMD AM4, M-ATX, DDR4;R$ ----
677;Placa Mãe Asus TUF Gaming H570-PRO Wi-Fi, Intel LGA1200, DDR4, ATX;R$ ----
678;Placa Mãe Asus Prime B560-PLUS, Intel B560 Socket LGA1200, ATX, DDR4;R$ ----
679;Placa Mãe Asus EX-B560M-V5, Intel LGA1200, ATX, DDR4 Placa-Mãe Asus EX-B560M-V5, Intel LGA1200, ATX, DDR4;R$ ----
680;Placa Mãe Gigabyte B560M DS3H, Intel LGA 1200, Micro ATX, DDR4, (rev. 1.0);R$ ----
681;Placa Mãe Asus Prime B560M-K, Intel B560 LGA1200, mATX, DDR4;R$ ----
682;Placa Mãe ASRock 760GM-HD, AMD AM3/AM3+, Micro ATX, DDR3;R$ ----
683;Placa Mãe Gigabyte H510M S2H, Intel LGA 1200, Micro ATX, DDR4, RGB, (rev. 1.0);R$ ----
684;Placa Mãe MSI MAG B560 Tomahawk Wi-Fi, Intel LGA 1200, ATX, DDR;R$ ----
685;Placa Mãe Gigabyte X570S Aorus Pro AX , AMD AM4, ATX, DDR4, LED RGB, Wi-Fi, Bluetooth, (rev. 1.0);R$ ----
686;Placa Mãe Gigabyte Aorus X570 Aorus Pro, Wi-Fi, AMD AM4, ATX, DDR4, (rev. 1.2);R$ ----
687;Placa Mãe Gigabyte GA-B85M-D3PH, Intel LGA 1150, mATX, DDR3;R$ ----
688;Placa Mãe ASRock AM1B-MH, AMD AM1, mATX, DDR3;R$ ----
689;Placa Mãe Gigabyte GA-78LMT-USB3 KaBuM! E-Sports, AMD AM3+, mATX, DDR3;R$ ----
690;Placa Mãe ASRock N68-GS4 FX R2.0, AMD AM3+, mATX, DDR3;R$ ----
691;Placa Mãe Gigabyte GA-B150M-D3H, Intel LGA 1151, mATX, DDR4;R$ ----
692;Placa Mãe Asus M5A78L-M Plus/USB3, AMD AM3+, mATX, DDR3;R$ ----
693;Placa Mãe MSI H110M Gaming, Intel LGA 1151, mATX, DDR4;R$ ----
694;Placa Mãe Gigabyte GA-H110M-H, Intel LGA 1151, mATX, DDR4;R$ ----
695;Placa Mãe ASRock H110M-HG4, Intel LGA 1151, mATX, DDR4;R$ ----
696;Placa Mãe Asus H110M-CS/BR, Intel LGA 1151, mATX, DDR4;R$ ----
697;Placa Mãe Gigabyte GA-B150M-Gaming 3, Intel LGA 1151, mATX, DDR4;R$ ----
698;Placa Mãe Gigabyte GA-H110M Gaming 3, Intel LGA 1151, mATX, DDR4;R$ ----
699;Placa Mãe Gigabyte GA-AB350M Gaming 3, AMD AM4, mATX, DDR4;R$ ----
700;Placa Mãe Gigabyte GA-H270M Gaming 3, Intel LGA 1151, mATX, DDR4;R$ ----
701;Placa Mãe ASRock Z270 Killer SLI/BR, Intel LGA 1151, ATX, DDR4;R$ ----
702;Placa Mãe Asus Prime B250M-Plus/BR, Intel LGA 1151, mATX, DDR4;R$ ----
703;Placa Mãe MSI H110M Pro-VH Plus, Intel LGA 1151, mATX, DDR4;R$ ----
704;Placa Mãe Gigabyte Aorus Z370M Aorus Gaming, Intel LGA 1151, mATX, DDR4;R$ ----
705;Placa Mãe Gigabyte Aorus B360 Aorus Gaming 3, Intel LGA 1151, ATX, DDR4;R$ ----
706;Placa Mãe Gigabyte B360M D3H, Intel LGA 1151, mATX, DDR4;R$ ----
707;Placa Mãe ASRock H370 Pro4, Intel LGA 1151, ATX, DDR4;R$ ----
708;Placa Mãe MSI B360M Gaming Plus, Intel LGA 1151, mATX, DDR4;R$ ----
709;Placa Mãe MSI B360M Mortar, Intel LGA 1151, mATX, DDR4;R$ ----
710;Placa-Mãe MSI H310M Pro-VDH, Intel LGA 1151, mATX, DDR4;R$ ----
711;Placa Mãe Asus Prime H310M-E/BR, Intel LGA 1151, mATX, DDR4;R$ ----
712;Placa Mãe Gigabyte B360M DS3H, Intel LGA 1151, mATX, DDR4;R$ ----
713;Placa Mãe Asus Prime B450M-K, AMD AM4, mATX, DDR4;R$ ----
714;Placa Mãe Asus Prime Z390-P, Intel LGA 1151, ATX, DDR4;R$ ----
715;Placa mãe Gigabyte Aorus X570 Aorus Master, AMD AM4, ATX, DDR4;R$ ----
716;Placa-Mãe Asus ROG Strix X570-E Gaming, AMD AM4, ATX, DDR4;R$ ----
717;Placa Mãe Gigabyte Aorus Z390 I Aorus Pro Wi-Fi, Intel LGA 1151, Mini-ITX, DDR4;R$ ----
718;Placa-Mãe Gigabyte X299X Aorus Master p/ Intel LGA2066, E-ATX, DDR4;R$ ----
719;Placa Mãe Gigabyte TRX40 Aorus Pro Wi-Fi, AMD TRX4, ATX, DDR4, (rev. 1.0);R$ ----
720;Placa Mãe Gigabyte Z490 UD AC, Intel LGA 1200, ATX, DDR4;R$ ----
721;Placa-Mãe Asus Prime H410M-K, Intel LGA 1200, mATX, DDR4;R$ ----
722;Placa Mãe Asus Prime H410M-D, Intel LGA 1200, mATX, DDR4;R$ ----
723;Placa-Mãe Asus TUF Gaming B460-PRO (Wi-Fi), Intel LGA 1200, ATX, DDR4;R$ ----
724;Placa Mãe Asus TUF Gaming B460-Plus, Intel LGA 1200, ATX, DDR4;R$ ----
725;Placa-Mãe Asus ROG Strix Z490-E Gaming, Intel LGA 1200, ATX, DDR4;R$ ----
726;Placa Mãe Asus Prime B460 Plus, Intel LGA 1200, ATX, DDR4;R$ ----
727;Placa Mãe ASRock H470M-ITX/ac, Intel LGA 1200, Mini-ITX, DDR4;R$ ----
728;Placa Mãe ASRock H410M-HDV/M.2, Intel LGA 1200, Micro ATX, DDR4;R$ ----
729;Placa Mãe Asus ROG Strix B550-F Gaming Wi-Fi, AMD AM4, ATX, DDR4;R$ ----
730;Placa-Mãe MSI B365M Pro-VH, Intel LGA 1151, mATX;R$ ----
731;Placa-Mãe Asus TUF B450M-Pro S, AMD AM4, mATX, DDR4;R$ ----
732;Placa Mãe ASRock A520M-HDV, AMD AM4, Micro ATX, DDR4;R$ ----
733;Placa Mãe Gigabyte GA-H110M-S2H, Intel LGA 1151, Micro ATX, DDR3;R$ ----
734;Placa Mãe Gigabyte B550 Vision D, AMD AM4, DDR4;R$ ----
735;Placa-Mãe ASUS TUF Gaming B550-PLUS (WI-FI), AMD B550, ATX, DDR4 - 90MB15D0-M0EAY0;R$ ----
736;Placa Mãe ASRock H570M-ITX/ac, Intel LGA1200, Mini-ITX, DDR4, WiFi, Bluetooth;R$ ----
737;Placa Mãe Asus ROG MAXIMUS XIII HERO, Intel LGA1200, DDR4, ATX, Aura Sync RGB - 90MB15X0-M0EAY0;R$ ----
738;Placa Mãe Gigabyte Z590 Gaming X 1.0, Intel LGA 1200, ATX, DDR4, M.2 NVME, RGB Fusion;R$ ----
739;Placa-Mãe Gigabyte Aorus Master X570S (Rev. 1.0), AMD Socket AM4, ATX, DDR4, LED RGB, Wi-Fi, Bluetooth - X570S AORUS MASTER;R$ ----
740;Placa-Mãe Goldentec, Intel 1150 H81M, SQBOX;R$ ----
741;Placa Mãe Gigabyte Z590I Aorus Ultra (rev. 1.0), Intel LGA 1200, Mini-ITX, DDR4, LED RGB, Wi-Fi, Bluetooth - Z590I AORUS ULTRA;R$ ----
742;Placa Mãe Gigabyte Z690I AORUS ULTRA (rev. 1.0), Intel LGA 1700, mini-ITX, DDR4, M.2 NVME - Z690I A ULTRA DDR4;R$ ----
743;Placa Mãe Asus Prime B660 Plus D4, LGA 1700 B660, ATX, DDR4;R$ ----
744;Placa Mãe MSI A520M PRO-VH, AMD AM4, mATX, DDR4;R$ ----
